[
  {
    "schema_version": "1.0",
    "alert_id": "alert_569d7922e39905fed74e20a7",
    "task_id": "task_exploit-chain-20260911T044921Z-c2",
    "timestamp_start": "2026-09-11T05:05:07+00:00",
    "timestamp_end": "2026-09-11T05:05:07+00:00",
    "event_ids": [
      "evt_1433118425b7a592e22754ea",
      "evt_ee6fb224f33c9371747c833c"
    ],
    "host_ids": [
      "legacycore01"
    ],
    "severity": "medium",
    "rule_id": "HOST-LINUX-SUDO-TO-ROOT",
    "rule_name": "Sudo command targeting root from a non-root account",
    "description": "Sudo command targeting root from a non-root account; requires analyst verification Authorized administration also looks like this; review the caller and command.",
    "mitre": {
      "tactic": "privilege-escalation",
      "technique_id": "T1548",
      "technique_name": "Sudo and Sudo Caching",
      "subtechnique_id": "T1548.003"
    },
    "confidence": 0.6,
    "evidence_summary": "{\"host_id\": \"legacycore01\", \"callers\": [\"msfadmin\"], \"sudo_events\": 2, \"reason\": \"sudo_command_targets_root\", \"execution_success_proven\": false, \"excluded_operator_accounts\": [\"labadmin\", \"labforensics\"], \"sample_count\": 2, \"score_kind\": \"heuristic_not_probability\"}",
    "detector": "host_heuristic_v1",
    "status": "open"
  },
  {
    "schema_version": "1.0",
    "alert_id": "alert_6d89d060c60d9ff73174192f",
    "task_id": "task_exploit-chain-20260911T044921Z-c2",
    "timestamp_start": "2026-09-11T05:05:07+00:00",
    "timestamp_end": "2026-09-11T05:05:07+00:00",
    "event_ids": [
      "evt_676c6282038e70efefeab3a9",
      "evt_9916cc64a69138fe22fae7b1",
      "evt_dda65bd09911ba18681364fe",
      "evt_f683515d5216102d273e6ec0"
    ],
    "host_ids": [
      "legacycore01"
    ],
    "severity": "medium",
    "rule_id": "HOST-LINUX-INTERNAL-SSH-LOGIN",
    "rule_name": "Remote login from another internal host (lateral movement candidate)",
    "description": "Remote login from another internal host (lateral movement candidate); requires analyst verification Source host is an internal asset, not the external attacker segment.",
    "mitre": {
      "tactic": "lateral-movement",
      "technique_id": "T1021",
      "technique_name": "SSH",
      "subtechnique_id": "T1021.004"
    },
    "confidence": 0.6,
    "evidence_summary": "{\"host_id\": \"legacycore01\", \"source_ip\": \"192.168.56.30\", \"login_events\": 4, \"reason\": \"remote_login_from_another_lab_host\", \"success_proven\": true, \"excluded_operator_accounts\": [\"labadmin\", \"labforensics\"], \"sample_count\": 4, \"score_kind\": \"heuristic_not_probability\"}",
    "detector": "host_heuristic_v1",
    "status": "open"
  },
  {
    "schema_version": "1.0",
    "alert_id": "alert_820aa6343ab67d66ab140b2c",
    "task_id": "task_exploit-chain-20260911T044921Z-c2",
    "timestamp_start": "2026-09-11T05:05:13.531362+00:00",
    "timestamp_end": "2026-09-11T05:08:33.499234+00:00",
    "event_ids": [
      "evt_12fdada45268e2cc8ea27050",
      "evt_1ca5fb933798cef0f6ac21b7",
      "evt_46b70f339246048e5ae50b5f",
      "evt_60c8d3052cc9146cbedeb3e1",
      "evt_67737d4584064142692a0f08",
      "evt_94ace1c6841e875939358eee",
      "evt_c08d9b865eefb3b67336bfc7",
      "evt_d7de36a8933e749fbc79edd7",
      "evt_dfdebaa347236ce49868a7cf",
      "evt_e62a4f2878fd551ce6fdc3f2",
      "evt_e6e8922e7c8ebdc382d0a293"
    ],
    "host_ids": [
      "legacycore01"
    ],
    "severity": "high",
    "rule_id": "NET-BEACON",
    "rule_name": "Periodic communication candidate (may be benign)",
    "description": "Periodic communication candidate (may be benign); requires analyst verification",
    "mitre": null,
    "confidence": 0.8999869214584366,
    "evidence_summary": "{\"span\": 199.96703386306763, \"regularity\": 0.9999346072921833, \"median_interval\": 19.996243476867676, \"stable_size\": true, \"sample_count\": 11, \"score_kind\": \"heuristic_not_probability\"}",
    "detector": "network_heuristic_v1",
    "status": "open"
  }
]