[
  {
    "schema_version": "1.0",
    "alert_id": "alert_146b6d0ba3333eb51d3bf9d8",
    "task_id": "task_exploit-chain-20260910T170757Z",
    "timestamp_start": "2026-09-10T17:07:56+00:00",
    "timestamp_end": "2026-09-10T17:21:55+00:00",
    "event_ids": [
      "evt_0600a2d60c0ac3a7c82e7cb7",
      "evt_4ce28dbe481ee092e30ec83b",
      "evt_7b5201a5a2a35e3410ddbd1c",
      "evt_9dfe74f58e6f9902bf81494f"
    ],
    "host_ids": [
      "legacyweb01"
    ],
    "severity": "medium",
    "rule_id": "HOST-LINUX-SUDO-TO-ROOT",
    "rule_name": "Sudo command targeting root from a non-root account",
    "description": "Sudo command targeting root from a non-root account; requires analyst verification Authorized administration also looks like this; review the caller and command.",
    "mitre": {
      "tactic": "privilege-escalation",
      "technique_id": "T1548",
      "technique_name": "Sudo and Sudo Caching",
      "subtechnique_id": "T1548.003"
    },
    "confidence": 0.6,
    "evidence_summary": "{\"host_id\": \"legacyweb01\", \"callers\": [\"msfadmin\"], \"sudo_events\": 4, \"reason\": \"sudo_command_targets_root\", \"execution_success_proven\": false, \"sample_count\": 4, \"score_kind\": \"heuristic_not_probability\"}",
    "detector": "host_heuristic_v1",
    "status": "open"
  },
  {
    "schema_version": "1.0",
    "alert_id": "alert_36e114480d00db999ca1cefa",
    "task_id": "task_exploit-chain-20260910T170757Z",
    "timestamp_start": "2026-09-10T17:13:41.278354+00:00",
    "timestamp_end": "2026-09-10T17:32:57.129851+00:00",
    "event_ids": [
      "evt_055384f535b2cfcb6ab136ef",
      "evt_1ab1f6121b96aaf80a4db202",
      "evt_1d81917d15222de204c9ec0e",
      "evt_1ea8284888d7872e883d1686",
      "evt_1f514a621381ea86d8ec2a6f",
      "evt_2c01fa9a4a620fa8c9e7a597",
      "evt_31e031815a210c2aaa26c3e4",
      "evt_55b4b2aa7b39dee16c7237f8",
      "evt_5bae116c8240c0a3a8f75d50",
      "evt_60423c3e24dcd88391fd6b0d",
      "evt_64f35d1a4333d6a02feb01a2",
      "evt_65742ef5f8261fa11007facf",
      "evt_708966a6803e4eaec8004db3",
      "evt_748278117e1c4c4c9287d246",
      "evt_bac3d7c11f445692a2e1b20d",
      "evt_f2caf2f91f4d7d1e4221afc0"
    ],
    "host_ids": [
      "attacker01"
    ],
    "severity": "high",
    "rule_id": "NET-IRC-BACKDOOR-EXPLOIT",
    "rule_name": "Automated IRC registrations followed by a reverse connection from the IRC service",
    "description": "Automated IRC registrations followed by a reverse connection from the IRC service; requires analyst verification",
    "mitre": {
      "tactic": "initial-access",
      "technique_id": "T1190",
      "technique_name": "Exploit Public-Facing Application",
      "subtechnique_id": null
    },
    "confidence": 0.85,
    "evidence_summary": "{\"span\": 1155.8514971733093, \"regularity\": 0, \"median_interval\": 10.011110067367554, \"irc_events\": 16, \"distinct_nicknames\": 8, \"reverse_connection_observed\": true, \"irc_server\": \"192.168.56.30\", \"irc_client\": \"192.168.56.10\", \"sample_count\": 16, \"score_kind\": \"heuristic_not_probability\"}",
    "detector": "network_heuristic_v1",
    "status": "open"
  },
  {
    "schema_version": "1.0",
    "alert_id": "alert_095b97dd038b1be5d1cba828",
    "task_id": "task_exploit-chain-20260910T170757Z",
    "timestamp_start": "2026-09-10T17:37:15+00:00",
    "timestamp_end": "2026-09-10T17:52:43+00:00",
    "event_ids": [
      "evt_0f6791341b31e7dbbf41ee26",
      "evt_1d2f7c5995b6cdb7bda9c1f5",
      "evt_25092df9f521a490a5656902",
      "evt_425fa70004455088a0ac6387",
      "evt_4b72ee28db3bb37b47e4efb2",
      "evt_5a1ba4b6fb29da37bbbe08a5",
      "evt_5a4ecff4b5c9632e798a517e",
      "evt_63176e874b5acea437f31dc4",
      "evt_6f147c5a63ca499406f1b81c",
      "evt_725804f9bf5340f90e08d99a",
      "evt_75596c2dd4178ce823178796",
      "evt_8dd2b2686cf2ab30940ec48a",
      "evt_90265ab5c288609f96972f3d",
      "evt_969718e754edbb7020faba3e",
      "evt_9886db450ab725d3f7cd65fe",
      "evt_c0881a7e5233857c2e0f2f1c",
      "evt_e2e80cdff29d37434bcb742e"
    ],
    "host_ids": [
      "legacycore01"
    ],
    "severity": "medium",
    "rule_id": "HOST-LINUX-INTERNAL-SSH-LOGIN",
    "rule_name": "Remote login from another internal host (lateral movement candidate)",
    "description": "Remote login from another internal host (lateral movement candidate); requires analyst verification Source host is an internal asset, not the external attacker segment.",
    "mitre": {
      "tactic": "lateral-movement",
      "technique_id": "T1021",
      "technique_name": "SSH",
      "subtechnique_id": "T1021.004"
    },
    "confidence": 0.6,
    "evidence_summary": "{\"host_id\": \"legacycore01\", \"source_ip\": \"192.168.56.30\", \"login_events\": 17, \"reason\": \"remote_login_from_another_lab_host\", \"success_proven\": true, \"sample_count\": 17, \"score_kind\": \"heuristic_not_probability\"}",
    "detector": "host_heuristic_v1",
    "status": "open"
  },
  {
    "schema_version": "1.0",
    "alert_id": "alert_852d50d5d006181eb129b0a9",
    "task_id": "task_exploit-chain-20260910T170757Z",
    "timestamp_start": "2026-09-10T17:37:38+00:00",
    "timestamp_end": "2026-09-10T17:43:21+00:00",
    "event_ids": [
      "evt_064beb74d1f559adfaff2f41",
      "evt_24a6b182295c9edf6792658b",
      "evt_5d27efb510ced68f5a1dc4b1",
      "evt_a0feeb5aaf00920b743cbf7d",
      "evt_da933a6f24325190cd9ebe9e",
      "evt_dd61d8de6579c4fd2a31122f"
    ],
    "host_ids": [
      "legacycore01"
    ],
    "severity": "medium",
    "rule_id": "HOST-LINUX-SUDO-TO-ROOT",
    "rule_name": "Sudo command targeting root from a non-root account",
    "description": "Sudo command targeting root from a non-root account; requires analyst verification Authorized administration also looks like this; review the caller and command.",
    "mitre": {
      "tactic": "privilege-escalation",
      "technique_id": "T1548",
      "technique_name": "Sudo and Sudo Caching",
      "subtechnique_id": "T1548.003"
    },
    "confidence": 0.6,
    "evidence_summary": "{\"host_id\": \"legacycore01\", \"callers\": [\"msfadmin\"], \"sudo_events\": 6, \"reason\": \"sudo_command_targets_root\", \"execution_success_proven\": false, \"sample_count\": 6, \"score_kind\": \"heuristic_not_probability\"}",
    "detector": "host_heuristic_v1",
    "status": "open"
  },
  {
    "schema_version": "1.0",
    "alert_id": "alert_a99115dd163c2c044db8f55b",
    "task_id": "task_exploit-chain-20260910T170757Z",
    "timestamp_start": "2026-09-10T17:43:07.778617+00:00",
    "timestamp_end": "2026-09-10T18:07:51.449940+00:00",
    "event_ids": [
      "evt_0a9d7652b5a9aef0a857e26a",
      "evt_0d6b7c12f5a6330872657ad5",
      "evt_141c3413c65b4ae129912e57",
      "evt_15b57fb4fcc0d26726301abc",
      "evt_175762837d09a2578712a6e7",
      "evt_1a103a17f13137686f8ecc9f",
      "evt_1bed14ca284b5a05d597f9b1",
      "evt_1ee12073d05801d61822acb8",
      "evt_217bbda98d435fd18ad0e77c",
      "evt_263ff50cdefbb84e7d037457",
      "evt_2c85d23552fb03f37b3915aa",
      "evt_39c3026301c39eaecd13e92f",
      "evt_3d92243b4b91bba6a051f824",
      "evt_45a903b041ad933b552b582b",
      "evt_4883d0a051beea1388a0c0cf",
      "evt_5459ffd23f527b03596682e1",
      "evt_59bef37e3d29ab5c1f49c780",
      "evt_647f18f30faa3e0a77700092",
      "evt_6aae84c461e5d1a656522a6b",
      "evt_75cb1fa55226c54e75ec38ec",
      "evt_78ed62c54cdefbe2d3ec88c8",
      "evt_7b847e6888dbf50bd6e45c32",
      "evt_893482e565d18f416b318586",
      "evt_8c3b5f47faf5749610ecca5b",
      "evt_9d71ca71c87e4df0ba24c78f",
      "evt_a8e8131b90b2a9b786f64fc8",
      "evt_aa4ab646c3700bb807164f3f",
      "evt_b85ee1124b8df3296cf54c21",
      "evt_b9eb08cfebc2f0061d267bc0",
      "evt_ba86a4c4f6dd938f2a5dff56",
      "evt_bca80d5e5c95a721ec6cd999",
      "evt_bd7861ee8adf0b228073144c",
      "evt_c517cf361e926b57ded0eabd",
      "evt_c9873b077e234cc055846d96",
      "evt_d11c257750cd848c4e3621f7",
      "evt_d226947fce6b62b9cf934eac",
      "evt_d98fbc9a2a5fe2b5fc3a85fe",
      "evt_e41eba487e5b78dd5bdd4244",
      "evt_f04861002a93ef8d63c60a23",
      "evt_f77d2fb7a3313a57aae16a0a"
    ],
    "host_ids": [
      "legacycore01"
    ],
    "severity": "medium",
    "rule_id": "NET-INTERNAL-SENSITIVE-UPLOAD",
    "rule_name": "Internal host uploaded a large volume to an external destination",
    "description": "Internal host uploaded a large volume to an external destination; requires analyst verification",
    "mitre": {
      "tactic": "exfiltration",
      "technique_id": "T1041",
      "technique_name": "Exfiltration Over C2 Channel",
      "subtechnique_id": null
    },
    "confidence": 0.75,
    "evidence_summary": "{\"source_ip\": \"192.168.56.60\", \"destination_ip\": \"192.168.56.40\", \"source_zone\": \"lab_vmnet2\", \"bytes_out\": 1510799, \"bytes_in\": 8108, \"connections\": 40, \"out_in_multiple\": 186.33, \"threshold_bytes\": 131072, \"content_bytes_proven\": false, \"sample_count\": 40, \"score_kind\": \"heuristic_not_probability\"}",
    "detector": "network_heuristic_v1",
    "status": "open"
  }
]