[
  {
    "schema_version": "1.0",
    "alert_id": "alert_95f2f749941595f103e4bbc6",
    "task_id": "task_exploit-chain-20260910T170757Z-c2",
    "timestamp_start": "2026-09-10T17:43:56+00:00",
    "timestamp_end": "2026-09-10T17:43:56+00:00",
    "event_ids": [
      "evt_6699b1cc517bcf05d4b9c108"
    ],
    "host_ids": [
      "legacycore01"
    ],
    "severity": "medium",
    "rule_id": "HOST-LINUX-INTERNAL-SSH-LOGIN",
    "rule_name": "Remote login from another internal host (lateral movement candidate)",
    "description": "Remote login from another internal host (lateral movement candidate); requires analyst verification Source host is an internal asset, not the external attacker segment.",
    "mitre": {
      "tactic": "lateral-movement",
      "technique_id": "T1021",
      "technique_name": "SSH",
      "subtechnique_id": "T1021.004"
    },
    "confidence": 0.6,
    "evidence_summary": "{\"host_id\": \"legacycore01\", \"source_ip\": \"192.168.56.30\", \"login_events\": 1, \"reason\": \"remote_login_from_another_lab_host\", \"success_proven\": true, \"sample_count\": 1, \"score_kind\": \"heuristic_not_probability\"}",
    "detector": "host_heuristic_v1",
    "status": "open"
  },
  {
    "schema_version": "1.0",
    "alert_id": "alert_83068a59dfc1686d1938a3ee",
    "task_id": "task_exploit-chain-20260910T170757Z-c2",
    "timestamp_start": "2026-09-10T17:43:57.177337+00:00",
    "timestamp_end": "2026-09-10T17:47:37.140870+00:00",
    "event_ids": [
      "evt_11b15dde0db52da776b84a94",
      "evt_1ac8a0ba2d405c7a19e3c493",
      "evt_2042f8141a9fa5e561a09f7a",
      "evt_32bead3f752c758e54d9d7d7",
      "evt_34ca78b3342a7895e36085c1",
      "evt_4a183f5f2c514dee690d6547",
      "evt_835f57180321a556e03cb22a",
      "evt_84e4d338fda5a6e88d6f65b9",
      "evt_b519c42694875e8fd03337ba",
      "evt_e9bb91896b9feb496dcd1777",
      "evt_f03cc4a2bf63f403884b8820",
      "evt_f5e4f4973162903019f15553"
    ],
    "host_ids": [
      "legacycore01"
    ],
    "severity": "high",
    "rule_id": "NET-BEACON",
    "rule_name": "Periodic communication candidate (may be benign)",
    "description": "Periodic communication candidate (may be benign); requires analyst verification",
    "mitre": null,
    "confidence": 0.8999786113584172,
    "evidence_summary": "{\"span\": 219.9614541530609, \"regularity\": 0.9998930567920861, \"median_interval\": 19.995622158050537, \"stable_size\": true, \"sample_count\": 12, \"score_kind\": \"heuristic_not_probability\"}",
    "detector": "network_heuristic_v1",
    "status": "open"
  }
]